{
  "$schema": "https://pigmint.dev/schema/audit-report-0.1.json",
  "artifactVersion": "audit-report@0.1",
  "run": {
    "id": "2026-04-24T01-41-37-816Z-b3a51a",
    "timestamp": "2026-04-24T01:41:37.816Z",
    "engineVersion": "0.0.0",
    "auditVersion": "0.0.0",
    "dtcgSource": "../src/generated/tokens.json",
    "builtSource": "",
    "profile": "wcag-srgb"
  },
  "summary": {
    "violations": {
      "error": 0,
      "warning": 4,
      "info": 0
    },
    "tokensAudited": 27,
    "tokensUsed": 0,
    "surfacePairsObserved": 0,
    "coverage": {
      "tokenUsage": 0
    }
  },
  "violations": [
    {
      "severity": "warning",
      "type": "contrast-under-target",
      "token": "color.foreground.subtle",
      "mode": "light",
      "expected": {
        "level": "AA-text",
        "kind": "wcag"
      },
      "actual": {
        "level": "AA-nonText",
        "ratio": 3.14
      },
      "suggestion": {
        "id": "sug-c3a9a95658",
        "channel": "intent-refinement",
        "target": "color.foreground.subtle",
        "rationale": "Token color.foreground.subtle passes AA-nonText but target requires AA-text in mode light. \"highest-contrast\" preference increases the margin.",
        "change": {
          "field": "defaultIntent.preference",
          "op": "replace",
          "value": "highest-contrast"
        },
        "confidence": "medium"
      }
    },
    {
      "severity": "warning",
      "type": "contrast-under-target",
      "token": "color.foreground.subtle",
      "mode": "dark",
      "expected": {
        "level": "AA-text",
        "kind": "wcag"
      },
      "actual": {
        "level": "AA-nonText",
        "ratio": 3.58
      },
      "suggestion": {
        "id": "sug-29fd42cc42",
        "channel": "intent-refinement",
        "target": "color.foreground.subtle",
        "rationale": "Token color.foreground.subtle passes AA-nonText but target requires AA-text in mode dark. \"highest-contrast\" preference increases the margin.",
        "change": {
          "field": "defaultIntent.preference",
          "op": "replace",
          "value": "highest-contrast"
        },
        "confidence": "medium"
      }
    },
    {
      "severity": "warning",
      "type": "contrast-under-target",
      "token": "color.foreground.subtle",
      "mode": "light-high-contrast",
      "expected": {
        "level": "AA-text",
        "kind": "wcag"
      },
      "actual": {
        "level": "AA-nonText",
        "ratio": 5.01
      },
      "suggestion": {
        "id": "sug-f46091cdf7",
        "channel": "intent-refinement",
        "target": "color.foreground.subtle",
        "rationale": "Token color.foreground.subtle passes AA-nonText but target requires AA-text in mode light-high-contrast. \"highest-contrast\" preference increases the margin.",
        "change": {
          "field": "defaultIntent.preference",
          "op": "replace",
          "value": "highest-contrast"
        },
        "confidence": "medium"
      }
    },
    {
      "severity": "warning",
      "type": "contrast-under-target",
      "token": "color.foreground.subtle",
      "mode": "dark-high-contrast",
      "expected": {
        "level": "AA-text",
        "kind": "wcag"
      },
      "actual": {
        "level": "AA-nonText",
        "ratio": 5.72
      },
      "suggestion": {
        "id": "sug-28ab42c200",
        "channel": "intent-refinement",
        "target": "color.foreground.subtle",
        "rationale": "Token color.foreground.subtle passes AA-nonText but target requires AA-text in mode dark-high-contrast. \"highest-contrast\" preference increases the margin.",
        "change": {
          "field": "defaultIntent.preference",
          "op": "replace",
          "value": "highest-contrast"
        },
        "confidence": "medium"
      }
    }
  ],
  "suggestions": [
    {
      "id": "sug-c3a9a95658",
      "channel": "intent-refinement",
      "target": "color.foreground.subtle",
      "rationale": "Token color.foreground.subtle passes AA-nonText but target requires AA-text in mode light. \"highest-contrast\" preference increases the margin.",
      "change": {
        "field": "defaultIntent.preference",
        "op": "replace",
        "value": "highest-contrast"
      },
      "confidence": "medium"
    },
    {
      "id": "sug-29fd42cc42",
      "channel": "intent-refinement",
      "target": "color.foreground.subtle",
      "rationale": "Token color.foreground.subtle passes AA-nonText but target requires AA-text in mode dark. \"highest-contrast\" preference increases the margin.",
      "change": {
        "field": "defaultIntent.preference",
        "op": "replace",
        "value": "highest-contrast"
      },
      "confidence": "medium"
    },
    {
      "id": "sug-f46091cdf7",
      "channel": "intent-refinement",
      "target": "color.foreground.subtle",
      "rationale": "Token color.foreground.subtle passes AA-nonText but target requires AA-text in mode light-high-contrast. \"highest-contrast\" preference increases the margin.",
      "change": {
        "field": "defaultIntent.preference",
        "op": "replace",
        "value": "highest-contrast"
      },
      "confidence": "medium"
    },
    {
      "id": "sug-28ab42c200",
      "channel": "intent-refinement",
      "target": "color.foreground.subtle",
      "rationale": "Token color.foreground.subtle passes AA-nonText but target requires AA-text in mode dark-high-contrast. \"highest-contrast\" preference increases the margin.",
      "change": {
        "field": "defaultIntent.preference",
        "op": "replace",
        "value": "highest-contrast"
      },
      "confidence": "medium"
    }
  ],
  "observations": {
    "undeclaredSurfacePairs": []
  }
}
