{
  "$schema": "https://pigmint.dev/schema/audit-report-0.1.json",
  "artifactVersion": "audit-report@0.1",
  "run": {
    "id": "2026-05-03T19-24-29-571Z-a1f50d",
    "timestamp": "2026-05-03T19:24:29.571Z",
    "engineVersion": "0.0.0",
    "auditVersion": "0.0.0",
    "dtcgSource": "../src/generated/tokens.json",
    "builtSource": "",
    "profile": "wcag-srgb"
  },
  "summary": {
    "violations": {
      "error": 0,
      "warning": 2,
      "info": 0
    },
    "tokensAudited": 13,
    "tokensUsed": 0,
    "surfacePairsObserved": 0,
    "coverage": {
      "tokenUsage": 0
    }
  },
  "violations": [
    {
      "severity": "warning",
      "type": "mixed-usage",
      "token": "action.primary.text",
      "expected": {
        "usage": "text",
        "source": "path-convention"
      },
      "actual": {
        "usage": "nonText",
        "source": "vocabulary-declaration"
      },
      "suggestion": {
        "id": "sug-18334bab58",
        "channel": "spec-gap",
        "target": "action.primary.text",
        "rationale": "Token action.primary.text is declared usage=nonText but its path implies text. Split into two tokens at design time (ADR-011): one for text/non-text contrast duty and one for decorative/visual use — a single token cannot satisfy both contexts without compromise.",
        "change": {
          "field": "vocabulary.usage",
          "op": "replace",
          "value": "text"
        },
        "confidence": "medium"
      }
    },
    {
      "severity": "warning",
      "type": "mixed-usage",
      "token": "action.secondary.text",
      "expected": {
        "usage": "text",
        "source": "path-convention"
      },
      "actual": {
        "usage": "nonText",
        "source": "vocabulary-declaration"
      },
      "suggestion": {
        "id": "sug-5d763245b8",
        "channel": "spec-gap",
        "target": "action.secondary.text",
        "rationale": "Token action.secondary.text is declared usage=nonText but its path implies text. Split into two tokens at design time (ADR-011): one for text/non-text contrast duty and one for decorative/visual use — a single token cannot satisfy both contexts without compromise.",
        "change": {
          "field": "vocabulary.usage",
          "op": "replace",
          "value": "text"
        },
        "confidence": "medium"
      }
    }
  ],
  "suggestions": [
    {
      "id": "sug-18334bab58",
      "channel": "spec-gap",
      "target": "action.primary.text",
      "rationale": "Token action.primary.text is declared usage=nonText but its path implies text. Split into two tokens at design time (ADR-011): one for text/non-text contrast duty and one for decorative/visual use — a single token cannot satisfy both contexts without compromise.",
      "change": {
        "field": "vocabulary.usage",
        "op": "replace",
        "value": "text"
      },
      "confidence": "medium"
    },
    {
      "id": "sug-5d763245b8",
      "channel": "spec-gap",
      "target": "action.secondary.text",
      "rationale": "Token action.secondary.text is declared usage=nonText but its path implies text. Split into two tokens at design time (ADR-011): one for text/non-text contrast duty and one for decorative/visual use — a single token cannot satisfy both contexts without compromise.",
      "change": {
        "field": "vocabulary.usage",
        "op": "replace",
        "value": "text"
      },
      "confidence": "medium"
    }
  ],
  "observations": {
    "undeclaredSurfacePairs": []
  }
}
